<?xml version="1.0" encoding="windows-1251"?>
<payment-list xmlns:xsi="http://www.w3.org/2001/XMLSchema-instance" xsi:noNamespaceSchemaLocation="../../../../../../../../settings/forms/PaymentList.xsd"
		title="Список заявок на открытие счета"
		>
	<filter>
		<fields>
			<field name="state" description="Статус"/>
			<field name="state_list" escription="Вспомогательный статус"/>
			<field name="refusingReason" description="Причина отказа"/>

			<field name="fromDate" description="Начальная дата" type="date">
				<validators>
					<validator class="com.rssl.common.forms.validators.DateFieldValidator"/>
				</validators>
			</field>

			<field name="toDate" description="Конечная дата" type="date">
				<validators>
					<validator class="com.rssl.common.forms.validators.DateFieldValidator"/>
				</validators>
			</field>

			<field name="claimType" description="Тип заявки"/>
		</fields>

		<form-validators>
			<form-validator class="com.rssl.common.forms.validators.CompareValidator">
				<message text="Конечная дата должна быть больше либо равна начальной"/>
				<field-ref name="obj1">fromDate</field-ref>
				<field-ref name="obj2">toDate</field-ref>
				<parameter name="operator">le</parameter>
			</form-validator>
		</form-validators>
	</filter>

	<hql-query>
		<returnKey property="id"/>
		<return property="dateCreated"/>
		<return property="changed"/>
		<return property="state.code"/>
		<return property="state.category"/>
		<return property="formName"/>
		<return property="fromAccount"/>
        <return property="state.description"/>
		<!--<return property="department"/>-->
<!--
		<return property="refusingReason"/>

-->
		<![CDATA[
		select claim
					from com.rssl.phizic.business.documents.DepositOpeningClaim claim
					where claim.owner.id = :loginId
						and (:state_list is null   or :state_list = '' or claim.state.code in (:state))
						and (:fromDate is null  or claim.dateCreated >= :fromDate)
						and (:toDate is null    or claim.dateCreated < :toDate + 1 )
						and (:claimType is null or :claimType = '' or claim.formName = :claimType)
		            order by claim.dateCreated desc, claim.changed desc, claim.id desc
			    ]]>
	</hql-query>
</payment-list>
