<?xml version="1.0" encoding="windows-1251"?>
<payment-list xmlns:xsi="http://www.w3.org/2001/XMLSchema-instance" xsi:noNamespaceSchemaLocation="../PaymentList.xsd"
		title="Список платежей на пополнение карты"
		>
	<filter>
		<fields>
			<field name="state" description="Статус"/>
			<field name="state_list" description="Вспомогательный статус"/>
			<field name="minAmount" description="Минимальная сумма" type="money">
				<validators>
					<validator class="com.rssl.common.forms.validators.MoneyFieldValidator"/>
				</validators>
			</field>
			<field name="maxAmount" description="Максимальная сумма" type="money">
				<validators>
					<validator class="com.rssl.common.forms.validators.MoneyFieldValidator"/>
				</validators>
			</field>
			<field name="fromDate" description="Начальная дата" type="date">
				<validators>
					<validator class="com.rssl.common.forms.validators.DateFieldValidator"/>
				</validators>
			</field>
			<field name="toDate" description="Конечная дата" type="date">
				<validators>
					<validator class="com.rssl.common.forms.validators.DateFieldValidator"/>
				</validators>
			</field>
			<field name="currencyCode" description="Валюта"/>
			<field name="cardNumber" description="Номер карты"/>
		</fields>
		<form-validators>
			<form-validator class="com.rssl.common.forms.validators.CompareValidator">
				<message text="Конечная дата должна быть больше либо равна начальной"/>
				<field-ref name="obj1">fromDate</field-ref>
				<field-ref name="obj2">toDate</field-ref>
				<parameter name="operator">le</parameter>
			</form-validator>
		</form-validators>
	</filter>
	<hql-query>
		<returnKey property="id"/>
		<return property="dateCreated"/>
		<return property="attributes.cardNumber.value"/>
		<return property="chargeOffAmount.decimal"/>
		<return property="chargeOffAmount.currency.code"/>
		<return property="state.code"/>
		<return property="documentNumber"/>
		<![CDATA[
			select payment
			from com.rssl.phizic.business.documents.InternalTransfer as payment
			where payment.formName = 'CardReplenishmentPayment'
			    and payment.owner.id = :loginId
			    and (:state_list is null      or :state_list = '' or payment.state.code in (:state))
				and (:minAmount is null       or payment.chargeOffAmount.decimal >= :minAmount)
				and (:maxAmount is null       or payment.chargeOffAmount.decimal <= :maxAmount)
				and (:fromDate is null     or payment.dateCreated >= :fromDate)
				and (:toDate is null       or payment.dateCreated <= :toDate  )
				and (:cardNumber is null   or :cardNumber = ''   or payment.attributes['cardNumber'].stringValue in
						(SELECT cardlink.number from com.rssl.phizic.business.resources.external.CardLink cardlink where cardlink.login.id=:loginId and cardlink.externalId=:cardNumber)
					)
				and (:currencyCode is null or :currencyCode = '' or payment.chargeOffAmount.currency = :currencyCode)
            order by payment.dateCreated asc, payment.id desc
	    ]]>
	</hql-query>
</payment-list>
